Id,ProductId,UserId,ProfileName,HelpfulnessNumerator,HelpfulnessDenominator,Score,Time,Summary,Text
495528,B001EQ554K,A3254B5H81J1FO,H. Dogan,0,0,5,1336435200,"best steak seasoning in the world , works great with chicken legs too.","this is a great mix and<br />I havent seen anyone who's not impressed with it.<br /><br />garlicy peppery sweetness without too much salt is excellent.<br /><br />add the dust to a ribeye (little of of olive oil if you like)  keep it in the fridge for 24 hours.<br />take it out at least 1 hour before and grill it medium or medium rate over charcoal , and have a potato add butter and sour cream, life doesn't get any better."
243729,B001FA1BYI,A27AF4DLLOBQDQ,"B. Marshall ""Bronco Fan""",1,5,3,1304294400,Noob's View to Marzipan,"I have always been intrigued by Marzipan - yet I had never tried it.  I guess the sound of the name draws me in.  So this order began my adventure into Marzipan.  To be fair, my Wife would probably give this a 4 or 5 Star rating.<br /><br />I have given this 3 stars, not due to poor quality, no poor taste - but rather being disappointed in reality meets expectations.  I am sure many will cry foul, that I hold this product to blame, but I think-it out this way: Reviews say this is the best Marzipan, Niederegger  will give me the ultimate Marzipan experience, experience falls short of expectations, therefore a 3 star rating.<br /><br />So why did this fall short, in my opinion 3 areas fell short: 1) Texture, 2) Flavor, 3) Sweetness.<br /><br />First to texture, I anticipated smoother and lighter than what Niederegger delivered.  This is a very rich, dense treat.  Subtle, yet kind of overbearing.<br /><br />Second is flavor - I anticipated a lighter, less earthy flavor.  While I really enjoy almonds, but this is almost almond overkill.  Its a very earthy flavor, subtle like almonds, but undeniable present.<br /><br />Third is sweetness - I was really expecting a sweeter treat, even with Dark Chocolate being the coating.  In my opinion, there is only a hint of sweetness, not a robust sweetness.  When I reach for sweets, I want sweet.  I did not want/expect an overly sweet experience like a candy bar, but maybe subtle fullness of a good peanut butter cookie.<br /><br />And just to really make a fan of Niederegger mad, I do enjoy these, but I just can't rate it any higher."
474119,B000CQC08C,A3UKSIXX4P9UAQ,K. Naranjo,1,1,5,1276473600,Delightful!,"First of all, the smell when you open each bag is very pleasing. I like the fact that each tea bag is individually foil wrapped for freshness. I enjoy this tea at least twice per day, especially mid-afternoon at work when time seems to stand still. If you like herbal spices you will definitely enjoy this tea."
320682,B000CQ26E0,A1SCMJP9WFQN6Y,Robert J. Bosworth,1,1,4,1235260800,"The best microwaveable macaroni, but not the best Annie's.","This is a very tasty snack, which is improved by some butter and milk.  It is not, however, nearly as good as old fashioned stove top macaroni.  I live in a dorm, so this is great for me, but if you have a little time and a modest kitchen, go for the old fashioned stuff."
73413,B000EPOC28,A3QL2873MKBV6E,"Lori M. Sobeski ""xanderman""",0,0,1,1222214400,MI-Del 100% Whole Wheat Honey Grahams,The entire case was stale & broken into bits. I will never buy this brand of crackers again.
67064,B0006348H2,A57Q87B0TC9IJ,Derek G,20,20,5,1287878400,"Tall, sturdy and lots of it","Had problems with a different brand because it either wouldn't grow or it would grow bugs.  This stuff grows nice, is very sturdy and long lasting.  Kitty loves her new dental floss (and occasional snack).  It's very tall and thick compared to most grass I've purchased in the past.  Growing it all at once may be more than your cat needs or wants.  I split mine up into quarters.  Great value."
470487,B001D9ZV5G,A4QXRLFVZN03N,Sara Hardigan,1,1,5,1165017600,LOVE IT,"I have an elderly dog with hip and joint problems. She has been taking Zuke's Hip Action Dog treats for a little more than a month and there has been a HUGE difference in her. She loves the way the treats taste; and best of all she is walking with ease, has an easier time with stairs and yesterday broke into a full sprint for the first time in ages! We followed the guideline for her size as listed on the back of the package and have been so surprised by the results. We love Zuke's!"
251513,B0011MZLEQ,A1R67TQJ83XDBG,"Debra ""crystalbluern""",0,0,5,1340323200,Wonderful...taste great,We are surviving summer with treats from home.  Also using small amount of the SUGAR FREE flavors in our bottled water - instead of crystal lite.
430069,B002FC6JZG,AANH72LEMCWSZ,Tom H.,0,0,5,1337990400,Good Collection Bag,We put this bag to the test on our first use stuffing it full as well as plenty of waste that was full of liquid. The bag was packed so full I had to pull on the bag when taking it out of the kitchen compost container that it stretched sort of like latex but did not tear or leak. The bag is a thin walled bag and I am hopeful that it will compost quicker than other bags I have tried.
220922,B0085E7B8W,A3S3EPKV4UB7WV,"Linda LaFleur ""Meemaw""",1,1,5,1302048000,Best Southern Tea ever!!!!,"Love Love Love this flavor...just as good or not better than I can make it. So easy with Keurig Brewer. Brew it and throw away...Sometimes hard to find Southern Sweet Tea, they are always out. Anyway, this is wonderful..very enjoyable."
148106,B000UXYJUE,A2TCJPQNV03NFQ,J. Notias,1,1,4,1272067200,In spite of.....,"In spite of the fact that there are some ten syllable words in along with this coconut milk, and in spite of the fact that one can equals 650 calories(!), it is the least expensive way to go for coconut milk, if you have Amazon Prime. The application I plan to use it for mostly is some ice cream. I've only made one batch so far, but I feel like I've died and went to heaven after eating the Strawberry/Vanilla/Coconut ice cream I made with this stuff yesterday, and I probably will die and hopefully go to heaven because there must be at least a million calories per serving, but what do they say about everything in moderation:~) I just substituted the coconut milk for the regular milk called for in the recipe and let me tell you......THIS IS THE RICHEST AND CREAMIEST ICE CREAM I'VE EVER TRIED!, it is sooooo silky, not a trace of ice crystals to be found anywhere, and the coconut flavor does come through. For a once in a while indulgence, use your favorite Vanilla ice cream recipe and use this stuff instead of the regular milk and....... knock, knock, knocking on heaven's door........ I also plan on baking up some Coconut Milk bread here shortly, will get back with comments when I do.<br /><br />P.S. At least half of the 24 cans came dented, so much so, that I dare not even chance using them, but I went to fill out an exchange form and found a link where I could get live  phone help with this problem. I filled in my phone number, I clicked the link, and I swear to god, I got a return call in under 10 seconds!!! And..... they are sending replacement cans by two day UPS, what great service!"
348908,B000FMZO90,AB1BRQX9QO43Q,"Robin L. Wright ""karefree99""",0,0,5,1190764800,Superb,Calbee Snapea Crisps are without a doubt the best new snack around - even my 18 month old granddaughter loves them.
278902,B00020V5N4,A30G94UTBIKMU8,"Cathleen D. Macauley ""fizzwing""",1,14,1,1243900800,ooops!,"Leonidas Belgian Chocolates: 1 lb Milk Chocolates Assortment<br /><br />Well...they sounded great to me! The reviews were great too! Off they went for Mothers' Day (shame on me). The ""giftee"" said they were "" the most ***awful chocolates I've ever had! I tried several...no carmels, no creams, no nothing! Just a pound of solid chocolate...don't ever give me anything else unless I ask for it!"" She needn't worry...I'm done."
551477,B001NGAT0Q,A1IXJEA1CXY7RJ,Rosie,0,0,4,1315612800,Better used to make jambalaya than soup,"Found this to be very tasty and while adding less fluid to make the real jambalaya, I also added more canned tomatoes.  Addinglarge shrimp it also became delicious as the family said.  Oh yes, I added more rice, too.  Great meal for lots of people."
306848,B000RI1W8E,A3AZ27UKODSICR,Cherry,2,7,1,1303862400,Taste,"It contains too much fat and when you bite it than you can feel the fat in your mouth, it's disgusting."
111494,B000ED9LIU,A3TSQVDK4TZ1VD,yosemite sam,2,2,3,1294963200,pluverized not shredded,"this item is just mediocre in taste, but what was disturbing was the shredded aspect. not by my definition. it is more like small grain rice size. think powder snow.<br /><br />the price is a tad on the high side compared to getting similar product at several other places."
164009,B001EO5QH8,A34RR4UYV8K30E,"S. Lantz ""handy helper""",2,2,5,1204761600,White Hot White Lightning,"On a whim, I purchased this product in a discount store since I love to try new things and, regular chili is not an option for me. Who knew it would turn out to be not only the office favorite but a home favorite as well.  The seasoning, veggies, taste, and consistency are excellent.  I've had so many requests for this chili that I recently purchased a large quantity to hand out to family and friends.  Do not let the name of the chili stop you from making it.  You can adjust the ""heat"" accordingly."
211489,B0002ARSR6,A1IBPV1XET5QQD,"Ms. Categorical Imperative ""Philosopher King ...",12,12,2,1149552000,Not for the heavy chewer,"Though I wasn't expecting a lot from a soft toy, I was hoping that this would be able to provide a little more relief for my teething pup.  While the bone is easy to use and freeze, the actual 'enjoyment' time is limited and not worth the time it takes to refreeze.  After about 5 minutes, the bone was thawed to the point it was dripping and could easily have holes chewed in the fabric.  When I went to refreeze it, my poor pup didn't understand why I was taking her toy and ended up becoming disinterested very quickly the next time I brought it out.<br /><br />Another issue I hadn't thought about until after freezing is how hard and heavy the bone becomes.  If you have a puppy that likes to 'throw' their toys or pounce on them, this can become a flying projectile.<br /><br />Though it did seem to help with the soreness of teething, and provide a cool treat, the overall experience left a lot to be desired."
254471,B0045U0V3C,A1JHCAG3BHVINX,David,0,0,5,1316390400,Nice product,"I bought a box of 6 packages. First it's very tasty and crunchy. The resealable design prevents it's getting wet. Finally I think it's a good deal, since I used to buy a small bag of the same brand at a higher price. Better to cut the cover open along the dashed line, otherwise it's uncomfortable to grab the crackers."
15646,B000255OIG,A2LN4UD395G2B6,Chwychuro,0,0,5,1320192000,Great Treat,This is great! The price is better than any stores around here and my dogs love it! Now they don't mind taking their pills
155960,B000GB7PXS,A91O85DGMEQBC,Deb,0,0,5,1342915200,Belgian Chocolate Rooibos loose tea,"I have truly enjoyed this tea.  I drink it most every day and it helps me to relax.  It is not meant to be a weight loss tea, but since I have started I have noticed great changes in my body weight and inches.  It has a great chocolate taste and with that taste helps me not to go for foods that are chocolate and not good for me.<br />I will definetely order this product again.  It give me lots of energy too.<br />I do wish for my next order the shipping not to be so high, it really defers me from ordering with the way the economy is these days.<br />Thanks D.G."
546539,B000E148MG,A3BSVEVBV9RZS2,Vegan Traveler,4,7,4,1154563200,Really 3 stars but I don't care for ramen noodles,"For a fast alternative to junk food this was hearty, easy to prepare and fast. I would have liked to see more vegtables in it. It enclosed a tiny vegi season packet and terriyaki sauce(sweet). Flavor was good but if you pour this sauce on ramen noodles, they would taste good. Why 4 stars? I like the way the noodles are packaged. I bought this a grocery store and would not buy again or buy this on Amazon. I ended up throwing some chopped up noodles in mine."
283763,B0047S8WFQ,A2EMFZ74YANT70,msed,0,0,5,1322611200,Great Jerky,"No gristle, not too tough, just right. Nice smokey flavor. Busted this out on a camping trip and it vanished. Will definetely buy again."
14392,B001CWV4PA,A3MZMMX88G8BVG,"D. Barletta ""dawnb""",1,2,5,1244160000,best gfcf cracker on the market,"These are the best tasting GFCF crackers on the market.  They do not fall apart, they are flavorful, and taste just like ""REAL CRACKERS""  My son who is a picky eater LOVES them!!!"
269266,B0009YF3TU,A1ADRUW91D3UNT,Joseph H. Stickrod,0,0,5,1291852800,super great... forceing my dogs wait till santa comes!,i got these in about 4-5 days after payment.<br /><br />i gave them one each when i got them. and put the rest away for Christmas...<br /><br />well my dogs didn't stupid they go up the the closet and sniff every time i open it lol<br /><br />so i assume they loved them
418846,B000MXHQXO,A24HT9FC6OU1J2,"Consuelo Maciel ""CONNIE""",0,0,5,1305849600,Good,Can't beat the price and convenience of buying online.  Don't have to waste gas and time going to the grocery store anymore for baby food.
419321,B0002DGRQ6,A3KXPLKL5EPJX,Judith M Dell,0,0,5,1350777600,Dogs LOVE it!!  Plus it is healthy...,"My dog would do anything for his liver treats!  ...and whenever any of his playmates are out for a walk they drag their owners to our house so they can have a liver treat as well (in fact most of their owners now buy it for them).  It is healthy, a great training treat, and they all love it!"
563409,B007JFMH8M,ABNMD6670TV53,"R. Kolin ""Third Degree member since 1991""",0,0,4,1346198400,"Tasty and a nice, quick snack","Quaker is pretty much the oatmeal company, and they have done a nice job with this oatmeal raisin cookie. I liked the convenience of being individually wrapped, which also preserves its freshness. I take one of these along during a round of golf and in my lunch. The cookie is tasty, light and moist. I recommend this to all cookie lovers, especially those fond of oatmeal raisin."
445852,B000LKZ9Q4,AI7KNSI036H3I,Mickey52,1,1,5,1347840000,YOU'LL NEVER MISS THE SODIUM!!!!,"I'm always on the lookout for products with low--or NO-- salt, because I have Meniere's Disase which requires an EXTREMELY low sodium diet. I found this tomato sauce in a local 'gourmet' type store, and decided to try a can. (The price was REAL scary, but it's SO hard to find good things...)<br />Well, folks, let me tell you - you'd never know this sauce is low-sodium!  It's perfectly seasoned and tastes delicious!!  A friend suggested I check Amazon.com, and was thrilled to find it; and at a significantly lower price.  I'm partway through my first 12-pack, and will definitely continue to order it. (I'm pretty sure I'm going to do ""Subscribe & Save"", and save even more next time.)<br />Just FYI, it's great on more than just pasta -- I've used it on both chicken and pork; eggplant and zucchini, and rice.<br /><br />As Julia Child used to say -- ""Yum!"""
380277,B000R7RLCQ,A19F7SXJZPL1VS,Debbie,1,1,4,1294704000,Ay yi yi yiiii!,Very easy to order.  This product is not offered in most retail stores but readily available online.  One thing that I would like to have seen on the product description is a reminder that this product is perishable and has an expiration date.  This should be known to the consumer but I wasn't thinking about that when I purchased it early in December for a Christmas present.  I would have waited a few more weeks.
350846,B0002ASB04,AQQLWCMRNDFGI,Steven A. Peterson,2,2,4,1257897600,Diet dog food that my dog likes!,"My German Shepherd is a wonderful friend. But she has a tendency to carry a little extra weight (not enough to be any great problem, but enough that the vet wanted her to lose a few pounds).<br /><br />This brand was recommended, and I am a very satisfied customer (and so is my dog, since she wolfs this food down). She has lost enough weight to make the vet happy. The food is tasty enough (at least her eating habits make it seem like it must be tasty to her!) that Asha (my dog) is happy. And her human family members are pleased that she has lost some weight and is, in the end, a healthier dog for it.<br /><br />So, I'm convinced that this brand does what it is supposed to do. . . ."
453132,B0029XLH4Y,A2EXT8FXO9E24E,"Larry8 ""Larry8""",0,0,5,1344643200,Good Strong Coffee,I found this coffee to be full flavored when brewed at 3/4 cup. Not really bitter at all with a smooth flavor. Not as good as Timothy's World Coffee Rainforest Espresso but pretty close.
214324,B0032JKXFI,A2Q9KBP6NZJ811,"Judy Webster ""Judy""",0,0,4,1281657600,good value,Not as good as nutrigrain bars but still good. Kids love them. Concerned about the quantity ordered but discovered they freeze well.
467818,B0006FJLAY,A1DXI9RC9KRZL9,Jami Webb,0,0,5,1330300800,Nice gift idea,This was a big hit at Christmas dinner with both kids and adults.  The set makes a nice hostess gift when visiting family or friends at the holidays and the candy was very tasty.
333275,B002U1HU7S,A34FK3VBLR3I62,M. Peters,0,0,5,1262476800,Best Hot Sauce Ever,"I love Hot Sauce and being of West Indian decent, this is one of the better hot sauces, the extra hot is gooooood."
71595,B000F6X5BK,A2W33TFHCANZPV,M. Agnone,5,6,3,1291852800,"A nice box, but a little pricey!","I purchased this as a gift for someone.  The box is a nice sized box, however, the box itself does not look like the one in the advertised photo. The paint, which is supposedly hand painted, is not as deep in color and detail as in the photo and the roses are not as defined as in the photo.  I expected this gourmet ""food"" gift basket to be that!  There is no food, and since it is a gift basket, I expected the items to be displayed coming out of the box as in the photo to make it attractive looking.  The items inside are packed inside with the box lid closed.  I found this gift was nice, but was a little disappointed in it.  I also thought it was a bit pricey at $60."
219844,B001E52VR0,A2WST5J71WIX5X,Mimi,0,0,5,1240531200,crystal light,I have this mailed to my mother on a regular basis.  Sometime this is the only way to get her to drink water.  She loves the taste.  Her favorites are the peach and the raspberry.
528657,B0052M09W0,A3V3FRNYD6RMYP,Pierre,0,0,5,1329696000,Cains Mayonnaise,"Cains Mayonnaise is the best store-bought mayo, period, far superior to the usual national brands. It has a distinct flavour all its own.  I venture to say that it is the Platonic Idea of mayonnaise. It's a pity that it not to be found in New York City."
343346,B0009F8M6U,A2YGFUDS144CU0,J. Anderson,1,1,5,1258416000,Excellent from first to last sip,"Like I said, this hot cocoa is EXCELLENT from the first to last sip. And it is a ""sipping"" cocoa. What I mean is that your first taste is good, but that is followed by a middle and after taste (from the first sip) are even better. I LOVE this cocoa!!!"
233553,B000JQALA4,A2ALZM1TT7SX6F,Planet MoMo,1,1,5,1272758400,My puppy loves her greenies!,"My 8 pound puppy gets a greenie every day.  She's a pretty picky eater, and usually takes forever to finish a meal (there are lots of breaks in between bites).  But her greenie is the only thing she will eat without stopping.  She loves the taste.  They also seem to be easy to eat - soft and chewy - so if your dog has sensitive teeth, this might be a good treat to consider.<br /><br />On top of that, greenies are supposed to help with your dog's dental health, which is great for me, because brushing my dog's teeth is really difficult."
501601,B0031TJ0X0,AHKPZ11JT110F,amazonbuyer,1,1,5,1295913600,Doesn't get any better than this!!! Nectar of the gods! Plus organic & fair trade!!,"I love this product and I love the fact that I can support the company because of its business ethics. This is the best tea and the best chocolate product I have ever discovered.<br /><br />I  found out about the tea by accident. I was really looking for chocolate nibs that were not covered in processed chocolate. Their chocolate nibs are sold through ""Eastbluff Trading Company"" and they got great reviews. The nibs are indeed amazing.<br /><br />But it is the tea that will keep me coming back. I plan to purchase this for all my tea and chocolate loving friends.<br /><br />Preparation: The instructions say to use 3 teaspoons full and steep for five minutes. I use more than the recommended 3 teaspoons, but I steep it twice. I also steep it for longer. After steeping I pour it into my Nissan travel thermos and add ""Sugar in the Raw"" to taste. The ""Sugar in the Raw"" enhances the flavor of any tea and it is the same with this one. I don't need much. It is delicious without the sugar, but it is my treat so I do like a little hint of sugar.<br /><br />As far as I'm concerned, this is better than a chocolate bar any day!"
348608,B000E46GFA,A2EDS2YOGL1541,Sew Perfect,3,3,5,1237161600,Good snack for kids,Kids love Rice Krispie Treats and this is a good alternative.  I'm so tired of everything being loaded with high fructose corn syrup.  You won't find that in these bars.  These are organic and that is great.  My kids love these bars and the cereal.
372072,B000SATIFA,A15UBF8KCPDDNW,"J. W. Garner ""fury2neon""",0,0,4,1285891200,"Excellent Tea The first time, less quality on the second order","The more I drink of this tea the more I like it.  It compares with teas twice it price. (On the first order.)<br /><br />I am on my second order of this tea, the flavor is just as good but I seems to have come from the bottom of the barrel.  Instead of the Gunpowder Tea I was expecting, it is more a powder like it has been crushed and none of the leaves are whole.  Though this does not impact the flavor it does make cleaning out the tea ball a lot harder."
77547,B003NC754G,A1BNIAGZBAGU6R,"judys4444 ""judy-m.p.""",0,0,5,1349395200,just wonderful from amazon,"love this popcorn & have lbs. in stock as I never want to run out of this product.  The kernels do not always pop; however, i love opened hard kernels to chew on.  Pop in hot air popcorn maker (1/2 cup kernels) & 2 tablespoons of butter & it is my reward dinner.  The sweet blue amish popcorn is my favorite - and i have tried many in my life."
106038,B000RHXH4W,A33775AIB1A664,"Mark Colan ""duke-of-url""",0,0,5,1324944000,Great selection for the price,"This mix has a good assortment of flavorful mushrooms that are great in stews.  I especially enjoy them in stews made with beef or lamb.  The can also be used in pasta sauces (try soaking, draining, sauteing to bring out more flavor).<br /><br />Can't beat the price for a good supply of dry mushrooms!"
417370,B000GG0BOI,A1KKGUI8WSEBZ4,N. Pierre,13,14,5,1166745600,Niiiiiiiice.....,"A friend recommended this tea, saying that it basically knocked her out at bedtime. I have two small kids so that really isn't a problem, but I liked the idea of a nice relaxing tea to enjoy during a little quiet time at night.<br /><br />This tea is wonderful. I brewed it up, enjoying the vapors, then drank it in a leisurely fashion (while watching ""Scrubs"", but that's neither here nor there). It is very tasty. My cat wanted to eat the teabag in a big way, which was charming. Then she climbed up on my lap to smell my breath, which was just adorable.<br /><br />I didn't doze off on the couch, which I half-expected based on what my friend had said, but I was verrrry melllooooooow. In a good way. A very good way.<br /><br />If you love tea but can't drink the caffeinated stuff at night, try this. It is yum."
87416,B003TRFU06,A36QZBGWSEB0VG,memesgrdn,1,1,5,1313971200,Heartland Spaghetti-the Good Stuff,This was a super tasting pasta.  It did not stick together or taste very much different than regular wheat pasta.  Did not have the texture of rubber like some rice pasta's. Make sure to take note of recommended cooking time.  Will definitely buy again!
427586,B0006U7T1C,A38K7PYO6IX37I,A. Lawrence,0,0,5,1215648000,Dogs can't get enough,"We have two beagles and a chihuahua who absolutely love these things. I'm not sure what they get more excited about after dinner - their walk or their after walk Jumbone.<br /><br />I like that it helps give them something to get their chewing needs out on.<br /><br />My only complaint would be that our beagles can gobble these up in no time flat, but they do have very hard bites for being not very large dogs.<br /><br />These are getting hard to find in my area so I'm really happy to be able to order them here."
352821,B007FRCHRK,A1SJUG9W4I5ZJK,Elizabeth Giustina,0,0,3,1335139200,Chocolate mint tea,"This tea arrived on time and is the second time I have bought it.  It is ok but not exactly what I had hoped for, a sweeter tea.  When I use it with sugar crystals, the tea is better."
475441,B005CT9MP8,A1AY5CFCYD1ETT,coyle shine,0,0,4,1348531200,basic olives,Those olives are simple green olives. One can spice them or make tapenade . I think they are good value but no gourmet
505922,B001ELL512,AVHGI6LW9RQ1Y,juneymoon,0,0,5,1328054400,can't live without coffee,"I can do without a lot of things but I can't function (or be happy!) without my coffee.<br /><br />I like a good,strong (not bitter) cup of coffee. TULLY'S Italian Roast is excellent. If you're looking for a bit of variety, TULLY'S French Roast is also delicious."
242192,B000YDUZXA,A36TPGK44IOS8O,jewels50,0,0,4,1332460800,So Hot !!,Bought this for my husband.. He love's to try various kind's of olive's...He eat's them right out of the bottle with a fork  !!
