Id,ProductId,UserId,ProfileName,HelpfulnessNumerator,HelpfulnessDenominator,Score,Time,Summary,Text
59033,B002HQLY7S,AR89H8T4PVWSL,rumbull01,,0,5,1320192000,Awesome coffee,Purchasing this coffee was definatly worth it! Not only is it not that expensive but it tastes wonderful! Although you get 50 I had to purchase another box because my husband and I liked it so much.
514838,B007IVEP8C,A15VHPHU0V8GOH,"Judith A. Weller ""jw1917""",0,0,1,1345766400,Like Sugar Syrup,This has to be the worst product trying to pass itself off as caramel popcorn. I could taste no caramel or cinnamon. Just a bunch of watery sugar. Don't buy this product. Also it has a lot of unpopped kernels in it.
419751,B0029ZAOW8,A3CG7K9OQ5M0RI,reviewer,2,2,5,1278633600,Reviewer,"Can't rate this stuff highly enough, does as advertised, no let down as with sugar/caffeinated drinks.  There doesn't seem to be any addictive tendencies with 5-H-E which is nice.  I do not use this every day, great when driving to keep you alert behind the wheel.  Definitely the shizz.  Buy it.  Try it."
870,B000VKYKTG,A1C1Y0S6QPBM4W,R. Dzuris,0,0,5,1231286400,Great Buy,"These where great couldnt stop eating them.<br />Lowest priced anywhere and will buy even more next time.<br />Cant say enough about these, they where shipped faster than what I paid to have shipped also.<br />Thank you so much."
282582,B001EO5WZ4,A2MERSI1KHYIQB,"Kathy D. FERRELL ""Kat""",0,0,1,1325894400,Tastes Horrible!!!,Thank god amazon gave me my money back and I ordered some other Earl Grey Tea which I received today and it is great!  This tea tastes like it is old or something.  Do not buy this tea!!  Rated One star because they won't let me rate it no stars.
551806,B0042GXR8A,AR89H8T4PVWSL,Linda,0,0,1,1297641600,See's Candy,"I have always enjoyed See's Candy in the past.  However, this candy seemed old.  The color of the chocolates had a whiteish color like they have been packaged for a long time.  I was really disappointed with it.  Linda"
516873,B001SIXXWU,A3B1XBG7CMYK41,Roman,2,3,2,1322697600,Most of Jerky is dry and not fresh,Purchased this jerky with S&S discount after reading some good reviews and was very disapointed with the quality of meat.  About 80% of the pieces were very dry and hard - note that some of the package was good (primarily in the middle of the package) and some of it was too dry.
211680,B001UUOP8C,A15GK1KULYHI12,"BG in Chicago ""Kiril""",0,0,5,1344556800,Best and healthiest dog treats ever,"My dogs LOVE these treats, and I love them myself as they have few ingredients, all of them real food that I would readily consume myself. This is a wonderful product, try it out!"
463996,B001SB0HNA,A1KPALLWZ73M27,BeagleGrin,1,1,5,1302912000,"All around GREAT tasting sauce, not just for stir fry!","This is THE best Korean teriaki stir fry sauce EVER, I've used it for chicken and beef with a plethora of vegetables. It is GREAT. In a pinch, serve it over some spaghetti noodles or rice with chunked cooked leftover meats and veggies, and you have an ""instant better than takeout"" meal. I've taken boring chicken breast and have used this as a dip, and have also used it to liven up ""boring"" meals. It is good with other foods as well, for example it makes a great dipping sauce for won tons as well. Slightly sweet with the teriaki and kind of salty, and LOTs of garlic and whole sesame seeds (even though, I've been using this product for YEARS, I have noticed a decrease in the garlic an sesame seeds.)<br /><br />The ONLY problem is THIS: I get this at a local grocery, and when on sale I get two for 7 dollars. Not on sale they are still under five bucks a bottle!<br />I LOVE LOVE LOVE to shop Amazon, because WHY run out when you can have stuff delivered to you? It is all for convenience. HOWEVER, at $13.92 a pound (or about 10 bucks a bottle on here) I am going to be forced to drive the 4 minutes to my local grocery for this.<br />If I ever move and am forced to purchase online as the only way, I will do it. But for now, I'm making the drive. I can get 2 bottles for less than one on here. Sorry Amazon, it isn't YOU per say, but the seller who is offering this product is price jabbing.<br />Great sauce, but I wouldn't pay over 5 bucks a bottle for it, and certainly will NOT be paying 10 bucks a bottle for it."
146378,B00IUY,A3ET5C2A3CCNWJ,"Fred Worth ""Believer""",1,1,1,1328832000,The most bitter Hollandaise EVER!,"I've made my own Hollandaise for many years based on several recipes I was able to garner from some of the 5 star restaurant's chefs, and they were all palate pleasers. I decided to try a bottled one in order to save the time it takes to make it at home. After reading the 1st and only review for this product (which was a 5 star...I think the customer might have been trying to get someone else sucked into buying it!), I decided to try it. I purchased 4 jars. BIG mistake! This is the WORST TASTING Hollandaise I could ever imagine! Tried it at room temp, then tried heating it to see if the bitter taste would go away but to no avail. This stuff is horrible! The only nice thing about the product is the shape of the jar. I'm going to make a huge batch of my own home made Hollandaise and store it in the jars. Thought about giving the three unopened jars away, but I don't have any enemies I hate THAT much! I poured their contents down the toilet (hope it doesn't ruin my sewage system!) and thoroughly washed the bottles for my own use.<br />If you're looking to have a great Hollandaise sauce at home, I highly recommend you MAKE it at home!"
498736,B000HDK0DC,A1PMAOD2KBB10Z,Spiced Rum,1,1,5,1299715200,I love these pops!,"I am not a die hard candy person, but these are great!  They do cost a bit more; but they're not that much more.  And besides, you ARE putting it in your body, so I think you're worth it.<br /><br />They are made from real fruit extracts; ironic that that is so rare.  The taste has loads of flavor.  They taste like real fruit.  Nice and tart, not like that sicky sweet that I can't identify in the artificial flavored pops.  Blueberry and cherry are my favorite, but all are excellent.  While not health food, they are a healthier version of junk food.<br /><br />Enjoy!"
62579,B003V5HEXC,A371Z04GWURCYC,Rich Dolata Jr.,0,0,4,1338940800,Ok but I am not a fan of this chocolate - smells good when you open it though,Not bad but I wouldn't say as good as the hazel nut or vanilla nut but I am not really a chocolate fan. Like it but has to be good.
321702,B000F4094I,AQ88AZTV8PYC0,Anne L. Shepherd,4,,5,1156896000,A Little Bit of Britain,"Imagine that you are sitting  in a delightful British  tea- room , after a  busy afternoon .  The waitress arrives at your table with a tray , laden  with scones , sandwiches and cakes. In the middle of the tray is a steaming pot of hot tea .  Taylors of  Harrogate Tea Room  Blend  is exactly what would be served . Robust , hearty and full of flavor ,  this is just the  right  pick -me-up for the middle of the day .  I highly recommend it."
308512,BOOIHJ,A36FEPUTDN12KA,"a cute bear ""TNM""",0,7,5,1174176000,classy canned seafood,I love to eat canned seafood from Crown Prince and C P FANCY PINK CRAB MEAT AND FANCY WHITE  ARE THE BEST CANNED CRAB MEAT.
394353,B001E5E1LE,A30ZAP242J449S,Annnie ,1,1,5,1286236800,Simply Awesome...,"I was sceptical of the taste and texture of hemp before I bought it, but when mixed with raw milk, I love it! It has a gritty texture along with a mild and nutty flavor that is not too sweet and does NOT taste artificial like many whey proteins that are highly proceeded. This is done for the sake of the brainwashed consumer who thinks they need sugar (or fake sweeteners) to feel good. On top of that, it offers up a whopping 14 grams of fiber per serving --- not to mention it is an organic product! Nice! Nutiva makes fantastic products. I would recommend this product to anyone."
46273,B001EO5KSS,A1FCMQT7KJXCIQ,Boon,0,0,2,1349654400,Not a fan,"I had tried Fiber One and though I loved it, I was looking for something organic. After reading the reviews, I decided to give Barbara's a try. I had an immediate disliking to its taste. After trying it repeatedly, I still can't come around to its taste. I guess it's not for everyone."
936,B000ER6YO0,A13EBBWOMC0FUI,"Sherean Malekzadeh ""Sherean""",0,0,,1263168000,One of my son's favorites,"My son started eating this when he was around 8 months old; he's now 14 months old and it's one of his favorites. Unfortunately, they don't carry it at the local grocery store (they carry other varieties of Earth's Best; just not this one or his other favorites, Spinach/Potatoes and Spaghetti with Cheese); they do carry it at some of the Whole Foods so I buy them there. I'm so glad to find them on Amazon! I get TIRED of ringing up a gazillion little jars at the store.<br /><br />We use this as a base and mix in other things - bits of cooked broccoli, small pieces of meat. I've also started adding spices to introduce him to new flavors."
217041,B000G6MBWI,A1DMR4TXV10JBB,"A. Chrzanowski ""Dwarf Mama""",0,0,,1246665600,Don't stop carrying these chips,"The first time I ate these chips was in Aruba in 2007.  I couldn't find them in our area (CT) so you can imagine my joy when I found them on Amazon.  I love these and hope you continue to carry them.  Your prices are terrific too.  I pay $2.99 in Aruba and they run about $2.46 a bag when I buy the case of 12 through Amazon.  Good job!!!!  Only problem is, now everybody wants them here and they steal my bags when the case comes in, but that's ok...sharing is good."
496272,B008JKU2CO,A254HJEKU1NF2Y,TakeAPic,3,3,1,1332460800,Stale!,"Unfortunately, I got a bad batch! This box was apparently old because they are hard and nearly break my teeth when I bite into them.  I've eaten nearly every flavor of these KIND bars so I know what they are suppose to taste like and it's NOT flavored bricks! Stale!"
171745,B00139E43Q,A2OWR2PL3DLWS4,Love to Cook,1,1,5,1250208000,I LOVE these mints,"These are the best mints.  I'm allergic to GMO cornstarch which is in so many mints- and the mints that don't have it taste bad.  These mints are not so strong they burn your tongue, and they are pleasingly sweet- without being too sweet.  The Wintergreen are just perfect.  I always carry them in my purse."
391698,B000GFYRJE,AT40UJ4IXZRCF,tomato,0,0,4,1341273600,deserves five stars but lost one for not being offered organic.,"perfect oolong. really good. i actually went to teavana and tried their ""monkey picked oolong"" which is supposed to be such high end magical tea and laughed as it was no where near as good as this oolong.<br /><br />it's not the best i've had in the oolong department, but it's cheap, you can find it easy, and it beats some of the higher end oolongs that sell for quadruple the price!<br /><br />only thing is they don't make it in an organic variety, that is lame and the only reason it lost a star."
539412,B001BDDT8K,A2ZJDGVJ45AR5W,"Will Kalif ""StormTheCastle""",1,1,4,1229472000,Tempted to eat them myself!,"This is quite a unique brand of cat food. Their tagline is ""People food for cats"" and they are quite right. They smell and look delicious.<br /><br />There are basically two types of canned cat food in my experience, the first kind is the solid kind where you tip the can into the plate and the food retains the shape of the can. The second type is the  more liquidy type that you can spoon, almost pour into the cats plate. For me this second type is preferable because it has a higher content of liquid which I consider to be healthier for the cats urinary system. This cat food is of this second type.<br /><br />My cat is a very finicky eater and he takes time to adjust to new foods.<br />This package contains two flavors; the first is chicken pot pie which looks just like real chicken pot pie, right down to the light gravy, there are cubes of real chicken breast and it really looks like pot pie. My cat laps up all the sauce then moves on to the chunks of chicken.<br /><br />Second flavor is sesame chicken: This smells really good and the chicken is not chunked but in thin strips. My cat loves the sauce and will drain it all dry but is not too fond of the chicken. He will probably adjust to it over time. This is why only four stars."
412002,B000CQC05K,AINMG64N0CBEG,Oz,3,5,2,1261785600,not as good as Yogi Tea's Lemon Ginger tea,"I am used to Yogi Tea's Lemon Ginger Tea, and for a change I wanted to try Stash's.<br />Unfortunately, I will go back to Yogi Tea's Lemon Ginger which tastes much nicer."
224717,B000B8ZA60,A13YNYAYG5JZVU,"Rosa C. Spencer ""tennisjunkie""",1,1,5,1198713600,delicious - soothing,tried first in Fla.  could not find a vendor in Atlanta.  so good i looked far and wide to find the a distributor on the web.  will order regularly.  found some duplicates - this was smoother in taste.
177370,B004U49QU2,A3PECZX773ME74,E. K. Moseley,0,0,4,1309305600,OK,"""Chips Ahoy! Chewy Gooey Megafudge;"" I liked these cookies; however, they are a little on the too much chocolate for me. With that statement said, if you love chocolate then you will really like these. If you want less chocolate one cookie is enough and summer time put them in the frig and eat cold."
495047,B00271OPVU,A3NVD74QJYFCWS,Larala,1,1,5,1323043200,I absolutely love this syrup -- and that other too.,"I'm no maple syrup expert but I've been using maple syrup grade B for a number of years and I absolutely love the Coombs Family Farms one. It's thick, rich and complex. I like it with yogurt, pancakes, fruit, lemonade, in cooking, and even by the shot. However, after reading about maple country and maple syrup culture, I toyed with the romantic idea of buying directly from maple syrup makers. I recently was able to do that. I ordered a gallon of maple syrup grade B from Bear Mountain Vermont Maple (that's the place I chose after some research). Their sugar bush is in a remote mountain that borders Quebec and has never been farmed. Although the syrup is not certified organic, no pesticides or insecticides are used anywhere in the area. These are really nice, honest people and it was a great experience ordering from them. The syrup is great. And the price is good too: 1 gallon is $60 (including shipping) and is shipped in two half-gallon BPA-free containers that have an oxygen barrier coating on the outside to help the syrup stay fresh longer. The service was fast too. I got the shipment just 4 days after I placed my order (I live in Northern California). So yes, I'm really satisfied. I am not ready to say that I prefer this syrup to Coombs Family Farms'. They're both really good in my opinion. But ordering from Bear Mountain was more like getting my produce from a farmer's market kind of experience for me."
464456,B000UBD88A,AYVA1OS3PL19K,S. Dosaj,0,0,5,1325635200,Rare coffee,It's so hard to find Senseo coffee pods in markets these days. I buy online. I love the little coffee house froth on each cup. The smaller cups of coffee dispensed by the Senseo machine and slightly stronger roast are very European. I love my Senseo!
102885,B001ASCZS6,A1HFPTFCKUSFEI,SHC,0,0,5,1295136000,A really delicious tea!!,"This is a very enjoyable, refreshing tea with lemon and mint flavors. I think it's even a good dessert or snack tea. My grocery store is discontinuing Wissotzky - I found these teas on Amazon including this flavor which my store didn't stock. I'm really very happy with this tea and would order again."
141578,B005C3DTIK,A1ESB4HAI5G97C,Sue H,0,0,4,1328745600,good dog food for adult dog,"good food for adult dogs that need low mineral/protein content. BUT...PetSmart sells it, but is very slack on stocking it i've found out. Getting it through Amazon is easier believe it or not, than getting in the car and hoping to get it at my local PetSmart. Amazon does not just ""run out"", or ""forget to stock it"". Thank you Amazon!"
397972,B000V17MLS,A3C7KI4396ZZEV,knogle,0,0,5,1312848000,Best curry I can find,"My entire extended family gets this curry paste because it is the best we can find. I make it about once every two weeks. With rice and chicken, I easily get three large meals. Which works out to less than $2 per meal. I never add the butter as called for in the directions because it is absolutely flavorful enough without it. With subscription, it is cheaper than buying it in the grocery store.<br />I would give it more than five stars if I could."
103535,B002Z08RIA,A2EUS5A4V7AKAD,"G. Varghese ""gvarghese""",2,3,3,1312761600,Not great but I prefer Taste Nirvana,This isn't bad but it isn't anything spectacular. I've tried this and Taste Nirvana's brand and honestly I prefer Taste Nirvana because it tastes more natural.
456798,B0009ETA6W,APL8B8Y7T0ED8,Jinkster,3,3,5,1276473600,"Not a miracle cure, but definitely works","I ordered the supplement after realizing that pumping at work wasn't producing as much as I needed to cover what my 3-month old daughter drank at daycare, and I'm committed to exclusively breastfeeding for as long as the AAP recommends.  Currently I take two capsules with every meal (6 a day).  I began to notice increased engorgement probably about 48 hours after starting the supplement.  Since starting it, I've been pumping about 3-4 ounces more per day, which is enough to cover the gap I had been concerned about.  Although I myself was a bit gassy for the first few days, I didn't notice any side effects in my daughter (and I was definitely watching out for them).<br /><br />I should say, I had to stop taking the pills for a few days due to some minor surgery, and I did notice my supply go down again.  So the pills do work, but in my case at least I have to keep taking them to keep getting results.  I'm happy to do it for my baby :)"
277530,B000VK8AVK,A1B4T1Z4TJZUSX,"snowbie1k ""watchful eater""",0,0,5,1255564800,Healthy at a great bargain!,"Great for diabetics who struggle with what to have for healthy snacks!  Ordering online couldn't be any easier or more convenient with very quick/efficient delivery.  The online price is better than in the stores, too.  I couldn't be happier."
47248,B0029O10P4,A1B4PMJVY3Q38W,"E. McKee ""Book lover""",3,3,5,1289692800,This must be crack for cats,My four cats adore this.  They split one bag every night.  I mistakenly gave some  to a stray cat that I feed and he would not leave the deck until I gave him a whole bag.  My mother's cat is also addicted and requires a hand full every day.  She stares pointedly between my mother and her food bowl until she gets enough.<br /><br />Since one my cats has some dental problems this cat food is great as a treat that is good for them.
112183,B0002HAB64,A3KTRR4QTE2LUJ,paul e. benedict,0,0,5,1346371200,Great find!,"I got hooked on these little peppers in Mexico but they are next to impossible to find in the states. I finally found them on Amazon from The Latin Products, at a great price to boot, so I stocked up. They arrived promptly, well packaged, and were as good as I rememeber them. Great if you have a taste for the spicy!"
270848,B004RBT8KG,A35D075O30ZJS3,"Lillian R. Roche ""lroche""",0,0,5,1305590400,Love these brownies!!,"These are great!  I don't know about the price, but I haven't been able to find them at Costco anywhere, nor in grocery stores.  Amazon may be the way to go for me.  They are a tasty treat and you can forget a candy bar.  I love them."
195124,B0049Z5OSK,A1SQPBEUL9VEDR,Ruth,0,0,4,1348012800,Delicious and healthy treat!,"I wouldn't call these almonds sweet, but they do have just the right hint of sweet flavor that the almond is elevated and feels like a treat.  The taste and texture of almonds doesn't particularly appeal to me, but they're such a healthy snack that I'm glad to find this delicious option.  Also, the small container is the perfect size to have on your desk or keep in the car, or use as stocking stuffers like I plan to do for a couple of my healthy eating conscious friends!"
21521,B002QWP89S,A2AE869K5GLGN5,"Susola ""Book Lover""",1,2,5,1243814400,"Excellent seller, excellent service, excellent prices!","I would not only order from this seller again, I have also told all my friends about this seller's store!"
41057,B000M36L9E,A3AO8XB02QGYAX,"Cat B. ""Cat B.""",12,13,5,1223164800,Can't Live Without It,"I've used Cola Syrup for nausea since my mom gave it to me as a kid in the 1950's.  Now that I am in my late 50's and have developed problems with most medications, this is the only thing I can take for nausea.  Since I have chronic migraines, its a real life saver.<br />Cat B."
309814,B000ILILLQ,A3H8288VHL1607,Nicole Brown,0,0,4,1320278400,Pamela's cookies are fun and good,"Being a fan of Pamela's products, I had no hesitation in trying the chocolate chip mini cookies. These remind me of any store-bought, traditional gluten-filled chocolate chip cookie in that they taste normal and are not chalky and dry like so many other gluten free cookies out there. I like the size of these cookies because you feel like you are getting more out of your snack than one signle larger cookie. They are the perfect size for my children (who also love them) and the chocolate doesn't melt too fast and make a big mess. Yum!"
110918,B0085YB426,A2MLVRK0WCRA9W,D. Lacey,0,0,5,1296086400,"Awesome coffee, perhaps my favorite.","Timothy's World Coffee, Italian Blend for Keurig is likely my favorite all-around coffee blend. Somewhere between a medium and mild blend, this aromatic coffee is sure to  please the most discriminating of family and friends."
253517,B000N5Z5YI,A3833VXG1CNT1Q,Susan L.,0,0,5,1343779200,My 3 little dogs love these treats & they are made in the USA,"My three little dogs love these treats that are so easy to break into little pieces. I love that they are all natural, low fat and are made in the USA.  I used to use another brand that has been discontinued but I am liking these better due to how easily they break into small pieces and my little dogs like these better also."
458476,B000FFIL92,AIZVI0OK7XSIZ,M. Davidson,1,1,5,1246060800,fun and delicious,"I love Numi tea and this tea set makes a perfect way to try a variety of flowering teas they have.  Get together with a friend or just spend time alone resting and enjoying the next perfect cup of tea.  My favorite for taste, I must admit, is the beautiful black peony.  Some of the other's are more beautiful if it is the flowering teas you like best. Each person I've sent these to have enjoyed them very much.  The only con is the price.  Buying Numi is a little hard on my pocket book."
491614,B000BRWX0C,A1N4NAIHZF4J7X,"Dawndy12 ""Barely Surviving The Loss of My Dau...",0,0,1,1343779200,CHECK THE EXP DATE!!!,I JUST REC'D THE CHICKEN ONE TODAY 8/2/12  I ALWAYS ALWAYS CK THE DATES OF EVERYTHING I EAT OR DRINK..FOR MY FURBABIES TOO.. I CAN'T BELIEVE THE..ONE..TIME I DIDN'T (THANK GOODNESS ONLY GAVE ONE TREAT EACH TO EACH DOG) I COULDN;T BELIEVE IT THE DATE SAID ..BEST..USED//BY 7/13/12!!!!  ALL DATES ON EVERYTHING ALWAYS IS A YEAR TO TWO YRS AWAY..SO THIS HAD TO BE VERY OLD..HOW COULD THEY SEND SOMETHING THAT OLD! GRRR<br />HOWEVER THE CO IMMEDIATELY REFUNDED ME...BUT..IM OUT TREATS FOR MY GIRLS HAVE TO WAIT FOR ANOTHER KIND OF TREAT TO ARRIVE NOW!!<br />I WOULD REFRAIN ORDERING FROM THIS CO.
6051,B000H227BG,AC64J76R8B1M9,"OTG w/chickens ""Zookeeper Extraordinaire""",2,2,5,1238544000,"Rich, chocolatey beverage mix",We appreciate the short list of ingredients on the Ghiradelli hot chocolate mixes.  The Chocolate Mocha flavor is rich and chocolatey with out being overpowered by the coffee.  This is one of our favorite cold weather drinks.
481010,B004ZY34NC,A3W23D5PTALR0L,LWD,12,12,1,1344988800,Great Coffee - But don't buy it here.,"The coffee is rich and delicious... a great way to start the day or to end an evening meal.  But at $1.00 a cup it is way overpriced.  I bought my Nespresso coffee machine from an Amazon dealer.  The price was very good.  So I assumed that the cost of the coffee would be good as well.  I performed a Google internet search for the lowest prices on Nespresso coffee, and all search results linked to Amazon.  So I ordered 50 cups and paid $1.00 a cup.  Then, a few days later I found that I could order the same coffee directly from the Nespresso website for only $0.60 a cup.  This shows you how skewed the Google Search Engine is and also reveals that the ""deals"" on Amazon are not always good deals.<br /><br />Lessons learned: 1) The coffee is great!  2) Do not trust Google as a reliable source to point you in the direction YOU want to go in.  It only points you in the direction they want to take you in.  3) Buy your coffee directly from Nespresso and save 40% (and get faster shipping as well.)  4) Do not rely on Amazon for the best deals."
475057,B003DKT8AC,A2GGQ93VXT606F,M. Lefevre,1,1,5,1313107200,Darn Close,I am a happy camper they arrived today. I was addicted to the Sunshine raisin biscuit. Loved them as a child loved them as an adult my children loved them too. When I moved to Texas I could not find them so my source in California would send a case now and then. Like everyone else I was upset when they stopped making them. This biscuit is very close not as sweet as Sunshines. I read the list of ingredients not a lot of sugar or fat. I will feel good about introducing these to my 3 year old grand-daughter.
355656,B002QWP8H0,A18KK6UY5352LQ,Marybeth Novoselsky,0,0,5,1340668800,Greenies,Shipped very fast.  Great product for your dog's teeth.  I have been giving my poodle greenies ofr years now and my vet said that her teeth are just as white and healthy as a 2 year old dogs.  She is 10 years old.
