Id,ProductId,UserId,ProfileName,HelpfulnessNumerator,HelpfulnessDenominator,Score,Time,Summary,Text
161230,B008O3G2K2,A3JCWGHCVC2ZNF,Sheri in Reho,2,4,3,1317340800,Potentially messy but my dog loves it.,"<span class=""tiny""> Length:: 1:01 Mins<br /><br /></span>Lickety Stik is a lickable (vs. edible) dog treat that comes in a variety of flavors, such as bacon, liver and chicken.  The container looks something like an old-style stick of deordorant with a plastic ball under the cap that LOOKS like it would roll around, but is actually stationary.  You squeeze the bottle until the gravy-like liquid treat starts to ooze out AROUND the ball and the dog licks it off. If you're not careful (i.e., if you squeeze too hard, esp. if you are treating a small dog like mine), you could end up with a mess on the floor.  That said, it is not difficult to master how hard to squeeze to treat the dog...just be forewarned to squeeze gently until you find the right pressure to use.<br /><br />As you will see in the accompanying video, my dog adores the flavor (I was using the liver flavor Lickety Split in the video).  She whines for it sometimes several times a day (she knows where I keep it).  However, she has a sensitive stomach and I have had to switch over to predominantly allergy-formula food and treats to reduce (and almost eliminate) the frequency of her spit-ups.  The day after I gave her the first taste of Lickety Stik, she spit up for the first time in a few months.  Perhaps that had nothing to do with it and it was something else, but it did make me wary of treating her with this product too often.<br /><br />Note that the packaging says this product is ""All-Natural with Vitamins,"" that there is only ""1 calorie in every 10 licks"" and that there are ""over 500 licks per bottle.""  The product is made in the USA.<br /><br />I can see where this product would be an excellent one to use for training purposes or on car trips, when you don't want to have to carry a lot of treats with you.<br /><br />Edited 10/11/11 to add that, after reviewing a couple of other reviews, it appears that the rollerball is SUPPOSED to roll, which was my assumption, but it did not on either of the ones I have used (bacon and liver flavors).  I just opened them up and tried to forcibly roll the ball.  I was able to on one but not the other.  Perhaps it varies by container or perhaps it takes a good while of use before the ball starts rolling.  I've been using it about a week."
243224,B002NDIW5C,A1VAU8811S6YA6,thirdtwin,0,0,1,1350259200,Personally could not taste the pistacio,"In the case of the batch I got, there was an excessive amount of both salt and peanut oil in the mix of pistacio paste.  So much in fact that it destroyed the taste of pistacio completely and I was left with a taste closer to salt and rancid peanuts, there are other brands without the added mixers, perhaps I got a bad batch of paste but there was no pistacio flavor in the paste I recieved at all; which has not been the case with other pastes i've tried- nor did this happen when i've made my own paste without salt and peanut oil as a mixer. Your experience may vary, but there are unsalted pastes available, that do not use peanut oil to excess as a mixer."
461328,B000CORSCW,A17QVB70DD0O69,"Roger D. Westra ""Ireland92834""",0,0,5,1310342400,Smart PUffs Reall Wisconsin Cheddar,This is a an excellent product.  No trans fat and baked in an oven; no greasy fat that it is baked in.
116988,B001BCVY9W,A2R1HUYHXV7H18,"Kristi G., mom of Sage",4,4,4,1227571200,You can see this is quality food when you open the can,"I have 3 cats.  2 are inside and 1 is outside.  They all loved this food, especially my outdoors cat.  Unfortunately, my dog liked it even more, and it became a bit of a problem keeping him away while they were eating, and it normally is not a problem.  He is a very picky dog who loves fish, so I could tell by his reaction that the seafood taste was definitely good.<br /><br />As soon as I opened the can, I could see that this food includes real flake tuna - it is not very much different in appearance than Starkist tuna in the can for people.  It does not have that terrible smell that some wet catfoods do, (Like the Meow Mix Wholesome Goodness).  That is nice, because with some catfoods if you open the can and some flys on you, you have to go shower or smell like a fishmarket.  This food is not stinky like that.  It has a good enough smell to excite the cats, but the human noses here did not smell it in our trash or from across the room.<br /><br />I watched my cats closely, and my dog as well, since he got 'into it' and it treated their digestive systems well. Sometimes new food will make them sick, but this food did not in the least.<br />I am only giving this a 4 star because my cats did not finish the red snapper flavor either time I put it down for them.  They ate maybe 1/2 of it.  I don't think they liked that particular flavor as well as the others.  They ALL liked the yellowfin tuna the best."
531611,B005K4Q34S,A35NA371SV1PAH,J. Jones,1,1,3,1330041600,Too sweet,"Not enough coffee flavor and definitely to sweet.  It had good flavor, but I am just not used to the amount of sugar it had in it and I add a half cup of regular coffee to it to tone it down.  I wish I had realized that it contained sugar and cream, if I had I think I would have chosen something different and been a lot happier with the purchase.  Kids should love this coffee drink though...."
119306,B003Z7VYXW,A2ACUGNVT36JYX,Lyannah,0,0,5,1324857600,Excellent Yeast - Great Price!,"I do a lot of baking and this yeast has never let me down. I store it in my freezer and keep about 1 cup in my fridge for frequent use. The quality does not seem to deteriorate over time, so long as you freeze it in an air-tight bag.<br /><br />Whenever I run out of yeast, this is what I order. No complaints about Saf Instant Yeast, I'd never use any other brand."
361071,B000H0ZJIG,A3D7ZMAAU24H55,Spiffy,0,0,5,1305849600,Dog treats,"My dogs go crazy for these treats.  Zuk'es Mini Naturals Dog Treats are the only treats I order for my dogs.  All natural and small enough to train your dog, if needed.  Just perfect!"
380079,B000PWYJGO,A42M5X4WYU5QR,C. R. Ashton,2,2,5,1276905600,Love 'em!,"I didn't want this person's strange review to affect this product's good reputation. This is the most convenient form of chocolate there is! Very tasty too. If you ever find yourself in the Army and are lucky enough to get M&Ms in your MRE they are quite valuable for trade; and if you can bring yourself to part with them you're guaranteed have the upper hand while bartering. I can never part with them though. They're the best chocolate fix there is, hands down, especially if you don't like licking chocolate off of the inside of wrappers."
247623,B001EO5WTU,A2DU7309LC8YLO,"Miss Medina ""lovely bibliophile""",4,5,5,1300838400,Delicious and convenient,"Not much more to say-- I live in San Francisco and there are only two Coffee Bean locations in the city, both of which were often sold out of the French Vanilla coffee since it is so very tasty.  The coffee subscription option is perfect, and less expensive than buying in-store.  No complaints here!"
359971,B001EQ4AIC,AHUX65CTDEQD1,Betsy N. Lopez,1,1,5,1344211200,So delicious!,So flavorful! I'm addicted. The best almost I've ever tasted. They're a bit on the salty side...so if you like salty food then this is for you.
43086,B000HDJZEM,A3P0W67EGKHT5O,AgentBob,5,6,4,1288656000,Great Caviar!!!,"We just bought this caviar, its a great price, and if you buy at least $25 worth, it ships for free, so I got two boxes. I have had all sort of caviar, and for the price this is great, I do wish the eggs were larger, but that costs more. At $4.69 per 3.5 ounce jar you cannot beat the price. Would buy this again!"
525358,B00604VZX6,A2YGAQURDCSDZ4,Natalia Goldman,0,0,3,1334534400,I ordered 3 (sets of 9) and 3 were broken,"They are beautiful and taste great but as per above- three of my order of 27 were broken.  They are packaged with bubble wrap inidividually but still arrived broken.<br />I had to use them for party or woudl have returned them. thankfully, i ordered extras.<br />also- stick is rather flimsy... not a wooden stick as i had hoped... these bent a little"
263436,B001E5E25Y,A1YUL9PCJR3JTY,"O. Brown ""Ms. O. Khannah-Brown""",4,4,4,1186358400,Very Bergamot-y Tea!,"****<br />I enjoy bergamot a lot, but this tea was way too fragrant for me; still it was different and enjoyable to try. The bergamot flavor is strong, not subtle, and a bit overwhelming---it's all you can taste.<br /><br />The ingredients of this tea are premium black teas with pure oil of bergamot---that's all.<br /><br />The manufacturer writes: ""Oil of bergamot comes from the rind of a citrus fruit which grows very well in the Calabria region of Italy. Pure top quality oil of bergamot is expensive but no blend or man-made flavoring can match the ethereal aroma and finely nuanced flavor of the real thing.<br />Certain Earl Grey fanatics have grown especially fond of the top grade Calabrian oil of bergamot that we use and have asked for more, ..More,... MORE! Thus was born Stash Double Bergamot Earl Grey. In our Double Bergamot Earl Grey tea, the black tea base still serves as a solid foundation for this blend, but the oil of bergamot takes wing and soars to new unprecedented heights. The flavor is quite pronounced but not at all soapy or bitter which would happen with low grade oils. Is the flavor too strong? For a conservative drinker, maybe yes, but more adventurous types really seem to like it.""<br /><br />I must not be adventurous enough. I do agree with the manufacturer, though, and it might be the tea for you if you're a huge fan of bergamot and want a lot of it, and I also agree that it tastes pure, not soapy or bitter at all.<br />****"
366225,B001D9JC0G,A1QSA55UL82YJ9,John Shaeffer,3,3,5,1167782400,Excellent product,Our 2 Vizslas have done very well with this food since we switched from Foster Smith food last year.
522629,B007TJGZ0Y,AE67Y8RBN3ZKQ,Louis Dargin,0,0,4,1342828800,Pretty good cup of coffee,"Overall I prefer a stronger coffee than Gloria Jean's Butter Toffee, but I tried this coffee when in an accountants office and really liked the flavor.  It is not a K-Cup that I drink every day, but it is definitely good for a change of pace.  If it were a little stronger I would rate it five stars."
134829,B000SKS8JM,A31UJUB82AWL1,Dean Guattare,96,134,1,1240963200,Save your money,The seeds I got were clearly non viable and I threw all but one in the garbage. Terrible customer service as well.  I emailed 4 times to 3 different email addresses they have posted and never got a response.
434600,B005GYJUGK,A3BNHP4R38KPDV,Annika Davis,0,0,5,1351036800,Excellent!,I love this product. I wanted to make a home version of Dunkin' Donuts coconut cream coffee and this syrup did the trick. The bottles are huge and will last a long time.
223970,B004H6MV28,AKEN2LJN6UHFY,Dr. Marilyn M Parker,0,0,5,1350000000,Really good on a grey day!,"Thoroughly enjoyed each and every cup of Cafe Escapes Chai Latte in my previous order . . . so I'm reordering to enjoy as the days get shorter and cooler.  Don't have a Keurig Brewer, so I just empty the single cup pack in a mug, stir in boiling water, wait a minute, and then sit and enjoy!  <a href=""http://www.amazon.com/gp/product/B000GCS018"">Cafe Escapes Chai Latte K-cups for Keurig Brewers, 16 K-cup Box</a>"
402734,B0015ZIQ1O,ABCTKOL7X1TDI,"J. Mays ""Me""",0,0,5,1235692800,Best tea,I am not a big tea drinker..But to better my health I decided to get use to drinking tea because it is much better than pop. So in the last year I have tryed many teas. I usually have to put splenda in it. But I had this as an iced tea at a coffee shop and added splenda and it was a bit sweet..so the next time I didn't add anything to it and it was awesome!!!! I love this stuff. I will drink it as long as I can get it. Unfourtunatly I have to order it but its well worth it!!!!
38115,B000ODW8JO,A3P801BK2GRWOP,"Jeffery S. Brady ""jsb33""",0,0,1,1324598400,Dried out and hard - threw it away!  How old is your stock?,"Clarification - my review was from gum purchased from ""The Candy Company"". I have no experience with other suplliers.<br /><br />DON'T BUY!<br /><br />Used to love this stuff when we were kids, were excited to find it still available!  REALLY disappointed we we opened the first pack to find the liquid center totally dried out and the gum itself hard and old.  Open all the packs - same thing.  Threw the whole thing away in disgust, should have sent it back for a refund of my $10."
68916,B004KNJSF6,A2D2QEAMTFVUR3,katiev,2,6,1,1312070400,Flavor is weak,"I love Orange blossom honey, tried this for convenience factor but disappointed with this product.  The flavor is hardly distinguishable when placed in my tea.  I tried 4 sticks...same thing.  Not worth it, I went back to my other brand with the squeeze bottle."
380266,B003G84QWQ,A2BIBEX65035YG,Sherry A. Jorgensen,0,0,5,1340064000,Great Low Carb Snack,I recently tried these for the first time.  They are great when you want something crunchy and salty and are doing a low carb diet.  They are also wonderful crushed up on top of a salad.  I plan on ordering more and trying other varieties.
173213,B0014H18J0,ACZ7LPQ281ZR3,hoborg,1,2,1,1339632000,"it doesn't worth the price, after-taste is awful","I expected something better from this tuna, i don't know why!!! however, this tuna doesn't look good, dark like cat-food, the taste is strange the oil is not like olive oil to me, the fishy-taste stays in your mouth like a dead fish!!!  i don't like this tuna!"
137383,B001P05K7W,A38GEDBPC9FGLY,Kenneth M. Pianin,0,0,2,1289520000,Not Great For Large Dogs,"Even though these chews are advertised as suitable for ""large dogs"", they are not.  80% of the pieces are too small and thin to be safely chewed for more than one or two minutes by my puppy who is not even 5 months old.  Even though my pup seems to like the taste, I can't risk his health and safety on these improperly sized chews. Look for something else to provide to your dog to satisfy his urge to chew."
143451,B0007A0AQM,A1CCAGK2SRI6OM,Arctic runner,0,0,2,1284422400,My daughter calls them Pukes...Bring the nose plugs,I applaud the use of natural ingredients but that's where the applause stops... The smell is unbelievably bad ( Salmon) and my dog who is a treat nut is not too crazy about them either. Honestly they just smelled like rotting fish.
385008,B005AKJC0O,A2BFGQLYQXJV9A,Megan Sullivan,2,2,5,1323648000,huge hit,"Used these as a ""science project"" for kids to taste different flavors.  Could not have chosen a better product<br />And it arrived sooner than expected.  Yeah"
306473,B001BOQ3QY,A3J96H3C5XODXK,JP,0,1,5,1331164800,5 month Maltese loves it !,I was given Iams by the breeder when I purchased my 12 week old male Maltese puppy. After reading ingredients I wanted to do a change over to the Wellness and he loves it ! I had a lttle bit of the Iams left over so I mix what is left to the Wellness. He eats the Wellness first every time. I chose the better food for him and smart puppy chooses it also (: Happy !
166292,B004DN9LCS,A7O0SZ153FJT,Miss Terry,4,4,1,1313107200,What happened to my old Caribou Blend??,"LOVED Caribou Blend.  Found a great price at Amazon, ordered enough to last 5 or 6 months.  K-Cups had a different logo than my previous purchases, and tasted sooooo bad I couldn't drink it.  After opening several boxes and brewing several cups from each box, each cup as bad as the last, I decided to return the unopened boxes.  BUYER BEWARE--I had no idea that the seller would refuse to take back or refund anything on ""consumable"" products.  I'm out a lot of money for really bad coffee and can't find another brand that is as good as my old Caribou Blend.  Any suggestions??"
532281,B006G67A1Y,A18UU49KUGLBV1,Danielle S.,0,0,5,1349827200,Everything as expected.,"I bought this for myself and it is everything I dreamed of...coffee!<br />Unlike some of the other reviews that stated the one they received were random cups thrown haphazardly in a box, the one I received was nicely packaged. Mine came in two boxes of 35 each and I think it is nice enough to wrap and give as presents. There is a nice variety among coffee brands such as Wolfgang Puck, Coffee People, Green Mountain, Caribou Coffee, etc. There are some flavors that are great and others that don't do it for me, but that is why I bought it. I wanted to try variety without commitment. I would recommend this to anyone wanting to try different varieties or to give to a coffee lover as a gift."
138694,B001IZBE2Y,A2LE8F1T13U54H,Cameron Smith,0,0,5,1350172800,good stuff,"The peanutbutter ones are my favorite, but I really like these ones too. arrived quickly and fully intact. none of them are stale or damaged. Pretty good deal considering that usually cost $7-8 per box in stores."
500407,B003QNLUTI,A1XUBAZHHWNZDS,"Rebecca Bryant ""Becca""",0,0,4,1346976000,get a boost,"When i first received this product i was nervous to try it but after hitting amed day slump one afternoon i decided to try it. my first time using it I was really surprised by how much energy i had with no side effects. plus i didn't come down hard off the energy of it like others or have to run to ythe batroom every five minutes to pee like with coffee. Not sure I buy it all the time as it does get expensive but a definite once or twice a week use isn't bad.<br /><br />""I received a free sample of 5-Hour ENERGY from Smiley360."""
266075,B001E96JZG,A2II54B3VA45LN,Professional shopper,0,0,2,1294876800,Too spicy,"I really like the Rotini and zesty sauce in this brand, but the ziti and meat sauce is way too spicy. I can't tolerate spicy hot food and this dish set my mouth on fire. It also has too much garlic for my taste. I won't be buying this again."
498702,B000HDK0DC,A3SZAG11FJ2BYX,J. Hamilton,0,1,5,1246924800,"Yummy lollipops, yummy price, cheaper that Costco...",These are great!  I've ordered them twice and will continue to do so.  The variety of fruity flavors are great.
475456,B000EYLK2Y,A1B2PWF2KGR0A7,Harper,0,0,4,1167782400,Nice snack,"We enjoyed these, and they are a healthy snack.  They are not low calorie, but very nutritious."
274143,B0019FGRJI,A1PI8VBCXXSGC7,Lynn,5,5,5,1280448000,Orange and dark chocolate...yum...,"One of my favorite flavor combinations is orange and dark chocolate. I saw these on my grocery store shelf one day & decided to give them a try.  I wasn't totally sure of what I was getting. The word 'biscuit' confused me, but I'd heard that the British use that word for cookie.  The biscuit is more of a soft cookie about 1/4"" thick; it's topped with a stiff orange jelly & iced with a thin layer of dark chocolate icing. One of these cookies will satisfy my craving. I tried the raspberry flavor, but prefer the orange.<br /><br />Serving Size: 2<br />Servings per 5.29 oz Container: 6<br />Calories: 100<br />Total Fat: 3 g<br />~Saturated Fat: 1.5g<br />~Trans Fat: 0<br />Cholesterol: 10mg<br />Sodium: 35mg<br />Total Carbohydrate: 17 g<br />Dietary Fiber: 0<br />Sugars: 14g<br />Protein: &lt;1g<br /><br />Ingredients listed on product page under Important Information<br />Made in Belgium"
56414,B000EHL21U,AZ50F6MW6LWOD,Jokerfan,0,1,5,1279065600,Great for hot weather!,"These bars can be a little messy, as some reviewers have said. BUT Kashi did not insist on coating these with chocolate as all other health bars seem to do, so these do not melt in the heat! They get a little soft, but not melted, so you can leave them in your car, take them out in the heat, etc. Perfect for me."
549085,B000WV153I,AEIKXMN47HPEZ,Sunshine,2,2,4,1347235200,Great product but not ideal for making coconut milk,"The reason I bought this product: different pages on the internet describe how you can make coconut milk out of coconut butter (e.g. this one here: [...]) and I have been wanting to replace my regular coffee milk with a non-dairy product (I make cafe latte at home and end up drinking LOTS of milk!)<br />NOTE: My ultimate goal is to use products that have not additives.<br /><br />I followed the instructions; heated up a spoonful of coconut butter, added just a little bit of water -- enough for a cup of milk -- and stirred it until it was blended... it tasted great in my coffee but the texture was thin and watery (I guess that's why they use guar gum in other coconut milk products) and it doesn't really froth up (I didn't really expect it to but was still hoping it would!) so overall, it's a fantastic product and I will use it for cooking, baking etc. but sadly, it didn't really work out as milk."
529226,B009AFJ3I6,A3CFND0IL3S8XT,katfroode,0,0,5,1328227200,Ideal No Calorie Sweetener for Baking,"I have tried several different products for baking, but give Ideal No Calorie Sweetener the highest rating of them all.  1) Measures like sugar; 2) no after taste; 3) does not affect the moisture of the final baked product; 4) my husband and family can't tell the difference!"
81009,B000LKZDTW,A348P7NXYNQB1M,P. Jenkins,1,1,5,1250467200,Waiting for these to return,"I had to leave a review after reading some of the negative ones. I can't use soy or dairy so finding a milk substitute has been interesting. Many of the soy alternatives still list some soy in their ingredient list. This particular Rice Dream rice milk (organic, enriched, original) does not. Further, it is the closest to dairy milk that I have found and doesn't add it's own flavor to whatever you cook like almond (I like almond milk for some things) or hemp milks do. You certainly can live without the 8 ounce size but they sure are convenient. I do hope that Amazon gets this size back again."
329907,B002QWHJOU,A3M744ACHT1HGN,"E. Morris Azbill, Jr. ""Bogeyman""",0,0,5,1269043200,Bow Wow Yum,"Both of my dogs will practically sell their souls for a greenie treat.  They know that this is the sign that it is time to go into their crates for the evening and after getting a greenie, they willingly go to bed."
534882,B003ZT25P6,A1H8JUI9GNQKNR,Harold Harefoot,0,0,5,1320537600,New favorite,"I've been drinking these Maxwell House international coffees for years, but this pumpkin spice latte was a new flavor for me.  Well, it's also now my new favorite flavor.  This is just as handy and easy to make as all the others.  If you have any kind of taste for pumpkin flavored items, I'm sure you'll also like this as much as I do."
121972,B003M63C0E,AX0DOIT232126,Jet,1,1,5,1319932800,Holistic Select Dog Food,"I have been feeding my dog Holistic Select Radiant Adult Health Lamb Meal Formula for approximately 4 yrs.  He loves it and, in my view, it is a very healthy dog formula. I purchased this product because my dog had a urinary infection due to crystals in his urine when he was a small pup and my vet suggested I change his diet to a formula with a lower percentage of protein.  My dog has not had any problems since using Holistic Select. I rate this product 5 stars."
182602,B008RWUKXK,A32NJA2RRS1T9O,nzm098,0,0,5,1350777600,great cereal!,"It's not too sweet, not too bland. Just the right crunch. I like it with milk or mixed with yogurt."
99948,B000LQORDE,ACA2Z99MCVUPU,FEEL,0,1,5,1322611200,Nice noodle,"I am gonna buy this again for the future for myself, when I ate this completely. Thank you so much for this product in Amazon.com."
84316,B002Q7QML6,A23IWYZSUZM6P7,halniaz,0,0,5,1339200000,Very nice tea and great price.,"I like this tea, I bought it as a replacement for another brand of Peach and sweet ginger tea that came in teabag form. This is just as good and the price works better this way."
41461,B003OZYTY6,AVVFQBMVGJ5T3,moonlight,1,1,5,1298937600,Hansen's Fruit Stix,"Thrilled to find a drink that taste's great, low in calories, and is healthy. The Blackberry is a tea, however they have other flavors that are not tea and are wonderful. You can mix these flavors not only with plain water, but with any green or white tea that you brew at home to add for flavor. The fruit punch, mixed berry, or strawberry lemonade are all fabulous flavors, My hat is off to Hansen's and a HUGE Thank you to them, and to Amazon for carrying this product.<a href=""http://www.amazon.com/gp/product/B003P02EOW"">Hansen's Fruit and Tea Stix Drink Mix, Fruit Punch, 8 count boxes(Pack of 12)</a>"
15019,B0001B8W08,A1LP87TREDMZM0,"N. melnas ""tigersmom23""",2,2,5,1163030400,Strawberry Jam/Jelly,"Very delicious, fresh ,  home made taste and perfect on toast and crackers.  Highly recommend this seller and product, fast shipping, too!"
151544,B005E30WY2,A241PVKCR4JHAU,lukeallen,0,0,5,1348790400,Good rice,The rice is as advertised and good for the dish that I purchased it<br />for.  The rice was shipped in a timely fashon.
225190,B001LNTY70,A2PTFW5G285RHT,Jobarda,0,0,5,1341446400,Great healthy snacking,These are a delicious and healthy snack when eaten in moderation. The flavor is great and isn't too over powering at all. The wasabi flavor is strong and feels like it's going to be hot but the heat never really shows up.
541317,B002ZOCF0M,A2OLBR308RBNPA,ziptop,0,0,5,1338163200,Great Deal!!,"My husband and I were looking for great tasting coffee beans and tried this one. We like our coffee a bit stronger, and this fits the bill. We chose auto ship for extra savings, and I won't ever have to make an emergency run to the store. This is a Great Deal and Great Coffee!!!"
