Id,ProductId,UserId,ProfileName,HelpfulnessNumerator,HelpfulnessDenominator,Score,Time,Summary,Text
185010,B0082C8OKG,A158PGEYKXJCYW,Steffye,3,3,4,1343088000,It Works!!!,"This product is more than a candy.  It can be used as a settler for the stomach.  On a road trip I developed a terrible nauseating feeling and my stomach was queasy.  I know ginger is a good stomach soother.  We stopped to a small store along the way and this ginger candy was recommended.  It worked for me and my daughter.  It did take me a minute to adjust to the strong ginger flavor and texture.  It is chewy and slightly sweet.  Once I did, my queasy stomach was settled in about 20 minutes.  I would recommend this.<br /><br />It definitely has a strong ginger flavor.  If you like ginger no problem."
455644,B005HG9ERW,#oc-RXFX0AFFBDSJN,Steve Burns,2,3,5,1341532800,The Best Bottled Water out there,"My kids asked ""How can you review bottled water?"" While most people think bottled water is a silly I will drink no water but bottled water. I even use bottled water for making tea or flavored drinks and even ice cubes. I have very sensitive tastes and could never stand tap water even as a child. The really funny thing is that when I was a kid in the mid eighties I would freeze and then boil water and put it glass bottles and I loved it. Weird huh? Well bottled water is now a multi-billion dollar industry. My favorites were Aqua-fina and Smart water.<br /><br />This Essentia water is the best of both of my other favorites, it is filtered using reverse osmosis which truly gives the purest taste of any type of filtering process and it also infused with electrolytes for real hydration much like Gatorade is with out the added sugar and artificial colors. It is also alkaline instead of acidic which is suppose to be very healthy for the body and decrease internal environment for disease.<br /><br />It is very fresh and pure tasting, no plastic after taste and no weird spring water taste or heavy mineral taste. This is my new favorite bottled water."
332171,B000YDIXDO,A3FVE716F0RLV2,"A. Parrett ""Whirly Girl""",0,0,5,1291248000,Dog loves it,"It's true that these bones don't last long, but I don't think they were intended to so don't pay much attention to the sour grape reviews.  Yes, they're expensive, but they aren't meant to be fed to your dog every day.  It's a TREAT for them, not a chew toy.  So be aware of what you're buying.  This isn't a chew bone; it's a very special treat."
377201,B003ZJ2DOY,A2210DCB083P3F,Jaco,0,0,5,1305158400,Great choice for celiacs,"Great taste, crunch, and quality! Never has caused a gluten reaction - all organic goodness. Not too sweet or salty. A healthy choice for those of you who love cereal but want to keep it healthy!"
384980,B0043GFKG6,A2WLS1TTUUGJYU,"jipsii M'Sina ""JMS""",2,2,5,1340841600,GREAT for allergen free diets!,"Hellmann's Canola Mayonnaise, 30oz<br />(Oddly enough the product link cannot find this!)<br />I cannot have dairy, gluten, soy, lime, mint or grapes, and this is THE ONLY mayo I can use.  It is WONDEFUL!  I use it in place of sour cream, sometimes make dipping sauces using it.  Add some dill, lemon, onion powder, etc. to make a bit of sauce for fish, etc.<br />Sometimes I put 1/2 C. of it in my cakes, gingerbread, etc., and they are moist and so Yummy!<br /><br />If you are on an allergen free diet, think of this as your all around sour cream, buttermilk (add a 1 tsp vinegar and about 1/3 C. of water or almond milk, stir and let sit about 10 minutes), etc.  It works wonders!  This is a MUST-HAVE in your kitchen.<br /><br />However, I am appalled at the prices here.  Get better prices at any other place - - Walmart, Cub, Target, Rainbow, Festival, Byerly's, Coburn's. etc.  Come on AMZ!  Wake up!"
318674,B001E5E33U,ATYUQROTHLNYV,Laurel,0,0,5,1282262400,Surprisingly Awesome,"I never really expected to make anything but coffee in my Keurig.  But making tea was starting to get awfully inconvenient, comparatively.  I figured these K-cups would be worth a try.<br /><br />Oh. Yeah.<br /><br />This is so good, and so fast.  Better than Twinnings tea bags, and probably better than loose tea (at least, with *my* skill at making tea.) If you like English style tea and have  Keurig brewer, you need to get these.<br /><br />Suggest adding some nice organic whole milk and a couple packets of Splenda."
38790,B000EGZ9AG,AR95GZ55DT9TL,N. Nickerson,4,4,5,1279152000,Not GMO,"From the RiceSelect website (that produces texmati):<br /><br />No, all RiceSelect products are produced from our non-GMO proprietary seed and is grown by our farmers under strict supervision in the United States. This complete control through the production process allows us to ensure that our products will not be co-mingled with other varieties that may have GMO traits."
373641,B006VC0ZYM,A18GKCC69KPR51,Norman Girard,6,7,4,1259539200,Origonal,"The best I can say is that the taste is quite origonal and unique.If you want the best and dont mind paying fot it then this is for you.<br /><br />The bad part is the large cost of the product.But, it is not disappointing in taste."
347191,B004O626OO,A3CG93783LP0FO,Yarii,0,0,5,1349395200,A little BOLD but very smooth,"I used to hate coffee. Now the more I drink, I'm wanting a little bolder flavor. This French brew is on the bold side, yet very smooth and I don't notice any bitterness at all. The aroma when it's brewing in the machine reminds me of the wonderful aroma on a plane when the flight attendants first turn the coffeemakers on. This flavor seems to have a tiny bit of chocolatey flavor at the finish just like the Viennese CBTL. The more I drink this one, the more it tastes LIKE the Viennese but bolder.  <a href=""http://www.amazon.com/gp/product/B004O5XB9Y"">CBTL Viennese Brew Coffee Capsules By The Coffee Bean & Tea Leaf, 10-Count Box (Pack of 3)</a>."
398096,B000V17MLS,A3CG93783LP0FO,Yarii,2,2,4,1330300800,"New to curry, here's my take on it","I was introduced to a Prima-brand curry paste a few weeks ago, not Indian, but a Singapore curry: <a href=""http://www.amazon.com/gp/product/B0041CIP3M"">Prima Taste Rendang Curry Sauce Kit, 12.7-Ounce Boxes (Pack of 4)</a> - unfortunately the price was too high for me, so I came across the Kitchens of India Paste for Butter Chicken Curry.<br /><br />While this is good, I prefer the Rendang Curry (with beef). Of course I used chicken with the KOI curry paste, and beef for the rendang.  The KOI has too much of a clove flavor for my taste, so I ended up adding 1/2 cup of light sour cream to it, and it was pretty good when served over rice.<br /><br />I'll try this with beef the next time, who's to say it has to be used with chicken?<br /><br />ETA - April 1, 2012:  Just tried this and used a lb. of beef stew meat instead of chicken. I thought it was better using the beef than chicken."
512552,B001EO6E06,A16IM9MYTHCKYQ,Penumbra,2,2,4,1217635200,Delcious dressing and fun culinary experimentation!,"Homemade Dressings has developed a neat concept that allows you to make your own dressings at home and tweak the combinations until you find the one that works best for your taste.  There are presently three different flavors that blend dried herbs and spices,  to which you add oil and vinegar to make fresh dressing on demand.  The Napa Valley blend contains garlic, citric acid, tomato powder and, I believe I taste, oregano and thyme in there as well.  The total effect is similar to an Italian herb dressing.<br /><br />I was fascinated by the blend and experimented with several oil and vinegar combinations.  With the oils I tried canola, vegetable and extra virgin olive.  I teamed those oils variously with red wine, white wine, balsamic and cider vinegars.  In my opinion, the strong flavors of EVOO, red wine vinegar, and balsamic vinegar overwhelmed the spices.  My least favorite dressing base was the EVOO with red wine vinegar; the resulting dressing had an overwhelming olive oil taste, and the strong red wine vinegar seemed sharp and harsh with the herb/spice mix.  My favorite was the Napa Valley blend with cider vinegar and vegetable oil.  That combination seemed to best showcase the herbs and spices; just a nice smooth dressing.<br /><br />In addition to making the dressing, I tried using the blend on some boneless skinless chicken breasts.  One piece of chicken was put in a baggie with the Napa Valley prepared dressing for a few hours before grilling.  It turned out all right - what you would expect from an Italian dressing marinade.  However, using the mix straight from the jar as a dry rub seemed to give the chicken a much more intense flavor.  I just sprinkled it over the chicken and let it rest for 20 minutes before grilling.  The mix was also very nice tossed with some pasta and a drizzle of olive oil.<br /><br />Recommended."
94997,B000CMF17S,AN97VUOW7NYX8,White Fang,1,1,5,1342569600,It works in a gentle way....I'm switching,"I have been using different supplements and medications to keep myself regular throughout my life.  Some over the counter medications are very harsh, they sometimes make you want to go at the time you are not supposed to.  Some would give me terrible cramping and keep me in the restroom for a long time.<br />I was using some natural supplement capsules before I discovered Yogi.  The capsules worked fine but are more expensive than Yogi taa.  Yogi gives me the predictable results the next morning.  I usually bring a few my favorite tea bags for a trip.  Now I bring a couple of this Yogi tea bags in case I get irregular during the trip."
524334,B000BHRBAE,A3I6J68C14EZ9R,A. Ochoa,3,3,5,1258329600,"""The Best Seaweed Soup Ever!""","I used 3/4 of a cup of boiled water per packet, and it turned out great! You can add thinly sliced sauteed beef and a small pinch of dried chili flakes to this soup to change it up, but it's perfect just the way it is.<br /><br />If you can visualize yourself taking a long deep breath of ocean air, the briney parfume filling your nasal cavity is the best way to describe your overall taste experience. Plus, it has just the right amount of soft, thin seaweed pieces.<br /><br />My four year old son loves it, he'll ask for two servings when I make it.<br /><br />""Kikkoman Instant Wakame Soup Is A Winner!"""
63652,B002IEZJMA,A2YB7DLC3FOR7W,"Pamela V ""&#34;MS V&#34;""",0,1,3,1338508800,Smells Good & Tastes Okay,"At 45 calories per 6.8 ounce can, I guess this drink is an okay mid-day boost, if you like chilled coffee and/or you can't get a freshly brewed cup.  I  love coffee, but wasn't impressed with this chilled espresso drink.  I wouldn't buy it."
163164,B00015UC8O,A2L5DRG9V6DQND,Corey Bogdan,25,25,5,1142640000,New Baking Necessity,"As a part-time ameature baker, I see dramatic results when incoporating this powder.  My breads have a much better golden color, and colleagues at work often compliment my breads on their appearance."
234369,B000F4H5GI,A2CYR6ZU8VOW8B,Cody Boy Brewery,0,0,5,1332115200,My absolute favorite!,"I've tried several different types of tea from Twining's and this is my favorite.  It's a great breakfast tea,(better than the English Breakfast Tea-not as strong), but it can be enjoyed all day long.  It's also great with a little milk."
110718,B00438XVGU,A1HY4GNNYQS88S,afan,1,1,5,1334016000,Good product,"It is close to the taste of fresh coffee. Moreover, it is cheap and convenient. I can have quick coffee every morning."
265426,B000FL521G,A3PCLOFFEODABJ,SenecaSister,0,0,5,1207440000,wonderful alternative sweetener,"with all of the info. on the dangers of chemical artificial sweeteneres, I was pleased to find a natural alternative that tastes great. I use it in hot bevereages and on hot cereals. I suppose you could use in cold beverages, but it would be like honey - hard to dissolve in cold."
227390,B000EDG3TU,A8WEXFRWX1ZHH,"Goldengate ""Goldengate""",2,5,2,1269820800,"Too sweet...and the flavor tastes ""off"" to me","Now that I'm stuck with 4 bags of this stuff, I'm trying to muscle through it (can't bring myself to throw it away)... but I really miss my old granola.  This product is too sweet, and has another taste (vanilla?) that I can't quite place but I find distracting from what should just be a good granola taste.  On a positive side, it's of good consistency and arrived tasting very fresh.  But usually I just can't eat enough granola, and with this product I feel like I'm taking medicine - it's not tasty.<br /><br />I'm mixing this in with cereal... perhaps this granola would be better suited for baking.  Sorry, I can't give this oatmeal my full endorsement."
36758,B001HTJ2BQ,A3JVBEITQELXSH,"JB ""Jae""",9,9,2,1309046400,Quality changed!,I've had a total of 4 shipments of this product.  2 shipments had quality fat and taste.  Thick nutritious fat clinging to the can. I had to put the product in the blender to blend it. I was impressed as this is how it should be. 2 shipments had poor quality. Very thin watery cans of product.  I even put the product in the refrigerator and it didn't thicken one little bit. That is unacceptable.  I have been debating on allowing another shipment to come with the hopes of getting a good batch or cancel my subscribe and save order for this product. I have decided to cancel and make my own coconut milk.
141569,B001BZ9R3O,A2DPYMNI2HCIOI,Angela Evans,2,3,3,1297728000,Where's the chocolate?,"I don't know if I happened upon a bad box of this cereal because bowl after bowl the question on my mind is ""where is the chocolate?"" Granola? Check.  Almonds? Check.  Chocolate? Negative.<br /><br />I have to say I'm a little saddened but the very visible absence of chocolate pieces in this cereal.  When I was half way through the box, I literally poured it out on a plate to see if there was one substantial piece of chocolate.  I found none.  I did find a few chocolate pebbles and I mean small, small pebbles that when consumed with the granola couldn't really be tasted.<br /><br />The granola itself has a pleasant flavor and I like almonds but I was excited to have a bit of chocolate in my bowl.  No such luck with this box.  Cascadian Farms makes some nice products and the granola cereal appears to have potential as a granola almond cereal.<br /><br />Parents: Be aware that the second ingredient for this cereal is sugar if you follow the rule that first, second, third,(whatever number) ingredient should never be sugar for kids."
396666,B0029JU348,A3ARWXNPHVQP1B,CherryLynn18,2,2,5,1295049600,Makes the best rolls and cinnamon buns,This product is extreemly hard to find at our local grocery stores and I was so pleased to have found it here. I ordered this a few days before Christmas and it arrived in plenty of time. Thank you.
385704,B0017PX7FW,A13DP4XZRDGWD9,_mads,1,1,5,1266710400,Wonderful - but can't pay the shipping to buy them from Amazon,"These are quite wonderful.  The gumminess is reminiscent of Haribo gummy bears which are my favorite and the flavors are nice too.  Too bad the shipping is so expensive, otherwise I would absolutely buy some from Amazon.  Maybe Fresh will pick them up."
133381,B0090X8IPM,AMNNPDX9MFEUD,Steve,0,1,4,1294790400,"Typcial Starbucks, but the vanilla helps..","Starbucks is notorious for having a bitter/burnt aftertaste. Such is the case with their packaged coffee as well. But the vanilla flavoring helped and made for a nice cup of coffee. I may not be the best person to review coffee since I take mine fairly sweet, but I enjoyed the cups I've had from this blend."
241037,B008EG58V8,AN0U0GNJJPEUR,N. Rogers,0,0,3,1339977600,a little plain,"They weren't joking when they said ""just a hint of cinnamon;"" I could barely discern any cinnamon at all.  This cereal wasn't bad, but it didn't have much flavor of any kind.  For such a plain cereal, Oatmeal Squares seemed a little high in calories especially considering the serving size is on the small side.  For comparison, I looked at another fairly plain cereal, Kix.  Kix has 110 calories with a serving size of 1 1/4 cups;  Oatmeal Squares has 210 calories with a serving size of 1 cup.  On the plus side, Oatmeal Squares held up really well in a bowl full of milk."
485770,B001RVFERK,A3S88SC5W0MC5H,crunchie,1,14,1,1295136000,Great Chips,"Just the right kind of chips, they are crunchie, light and wonderful.<br />Great for people dieting. They are popped, not fried or baked.<br />Try them you'll enjoy them."
482053,B0018KLPFK,A2NMQWBDWT3SQF,Lorel Shea,1,1,5,1271808000,YUM!,"I'm off gluten and trying to wean myself off dairy as well.  Larabar pecan pie has no gluten or dairy, and it actually tastes great!  The bars are 1.6 ounces, which I find just the right size for a snack.  The pecan flavor is sweet, but not too sweet, and the bar has a nice balance between soft and crunchy. There are 220 calories in each bar, and 130 of them are fat calories, but this is FAR healthier for you than any candy bar.  Ingredients are dates, pecans, and almonds- amazingly simple!<br /><br />Highly recommended."
392524,B000F70Y86,AF51KJB3W1YI6,"Ellay ""light""",0,0,4,1225929600,A Fine Gift ...,"I took a chance on this gift basket because it was on sale and I was not disappointed. This is a great gift for anyone who enjoys smoked salmon. There is a nice variety of sizes. The salmon comes vacuum packed, canned, and as a spread with a nice package of water crackers all in a very clean and crisp basket.<br /><br />Good value. Nice gift."
80061,B001ET5XZS,A1EML4MS8MZ627,"Ileana M ""Book Maven""",5,5,5,1293062400,I love this tea...,"I first had this tea at a convention several years ago and took a few samples, Then my mother-in-law ordered it for me for Christmas. And now I am ordering for myself. Its really smooth and light tasting and fruity and much better then the Herbal Lipton that I purchased by mistake. This one is really good and I make it each night before bed. You can also put a little Splenda or Honey in it as well. I tend to drink it plain, but sometimes I add the Honey or the Splenda. Enjoy !!!"
300664,B0079FMZ48,A3LCAN5P2HW014,dinderella,1,1,5,1310256000,Great Seasoning,"Great spice.  I use it all the time, especially with my fresh fish. Try soaking fresh fish in saltwater with 1-2 Tblsp. jerk seasoning added for 10-15 min.  Then prepare as desired.  Works great, taste fabulous."
347373,B0045GV3JC,A2EL8QT7C57PFL,Garlis,0,1,1,1314144000,Poor customer service,"I have used this product for several years.  When I couldn't find it at my local grocer I decided to order online.  All the bottles of sauce in the shipment have a 2011 expiration date.  Since each of the bottles is 28 ounces, I don't expect to be able to use much of the product prior to it's expiration.  I'm very disappointed in the seller and will not purchase from them again.  Seems they were only interested in disposing of old product."
15943,B000PDRYPQ,A1MRL1HQLPNH5,SwingSweetheart,2,2,5,1209427200,The BEST sauce EVER!,"My husband and I always have this at a local eatery, and WOW, it works with eggs, french fries, burgers, you name it. It's not as much Hot as it is SPICY and the balance of the garlic is a beautiful thing. It doesn't drown out the taste of your food as much as it adds to it or enhances it. It also doesn't have that obnoxious jalapeno taste that many hot sauces have. A must buy for the hot sauce or bbq sauce fan, or someone like me that just loves breakfast."
194262,B0009Y8AGI,AVNVY7Z0UJEZ1,Leisa,3,6,1,1267228800,Couldn't Get Past The Taste.....,"Chances are, if you don't care much for the taste of black licorice, you aren't going to find this tea very appealing.  The black licorice flavor was so overpowering  that I wasn't really able to distinguish or really even taste any of the other herbs/ingredients.  Have to give this 1 star (my first bad rating here on amazon) there has got to be a way to get the ingredients needed for ""healthy milk production"" without such a horrid taste.  Also, I BELIEVE the box said to let it sit for 10 minutes (rather lengthy time period) and to have at least 3 cups per day.  That's torture with the way this stuff tastes!"
557672,B001HTI4XI,A1A9PD00UVHHVI,"Juanita A. Floyd ""Life is too short to read b...",0,0,5,1350950400,My Go To Bread Mix,I've been using this stuff for years and I love it. Mix it up in the food processor and throw it into the dehydrator to rise. Excellent base mix that can be added to in many ways.
93507,B000EHP522,A1ZS914E7EZTWY,Euphwoman,0,0,4,1202860800,Great taste and texture,"Not too sweet, just the right crunchiness. Sometimes the caramel sticks to the wrapper and is a bit messy, but it's still a great bar for on the run."
375387,B001E0VTBO,A25EYJUE3Z4KTT,Singing Sweetly,4,4,5,1138406400,"It's Kosher, Organic, and Minimally Packaged with Awesome Flavor!","I have tried many a rooibois, and this one tops the list. It's kosher, certified organic, packaged with an extremely minimal amount of non-recyclable material and the best-tasting of the rooibois teas in teabags I have found anywhere. The only way to improve upon this is to buy it in bulk, directly from the africanredteacompany itself in Los Angeles. Highly recommended!"
358678,B003CIBPN8,A2JGXBY85A640W,"R.Natraj ""Life is Beautiful !!""",0,0,1,1338422400,Tastes very bad.,"Very bad taste, like rotten/stale drink. I had read pretty good reviews about ZICO coconut water, but on trying it totally disapointed. VITA COCO is way better than this."
505445,B001PMDYXW,A1OHG3I7UVGNFV,"dd ""cat lover""",7,11,1,1222905600,newmans own canned cat food,3 out of my 4 cats will not touch this.  Pretty pricey for alot of gravy & grain & little meat.
242373,B000F6QHRE,A3JA0ZMYRP7BE4,Christopher P. Deveau,1,6,5,1257379200,Unique and unedible,"Just picked these babies up at a local asian food market. You know your in for treat when in Asia, people believe that the tamarind tree poisons the air around it and people who fall asleep under the tree are dragged off to hell by demons. Every flavorful second will make you want to reevaluate your life. Also known as godzilla tear not because they are his tears but they are what caused godzilla himself to cry."
152905,B000KETAGG,A1WMFB07NHHTRR,"L. Detogni ""Lily""",0,0,5,1237334400,Amazing,okay so i ordered a free sample of one Greenie and my dog who is an 18 pound boy was in heaven with these bones.  he loved them so much that when he put it down to chew he actually hit my hand when i tried to pick it up! it was so cute and after i gave him this bone he was so sweet towards me and he was so kind.  buy these bones and give them to your dog.  they will love you so much more. trust me!
560325,B001BM6LVS,A8PP8NPRJSAKO,Brazilian Jazzaholic!,2,2,2,1326326400,Not a fan of BPA in baby food jar lids,"As I have with all other Earth's Best jarred baby food, I won't be purchasing these Dinners for my baby because the jar lids contain BPA.  I contacted Earth's Best's consumer relations dept. personally, and the representative read me a prepared statement saying that the epoxy resin that lines Earth's Best baby food jar lids contains ""trace amounts"" of BPA, but it ""doesn't come into direct contact with the food.""  That kind of lukewarm response wasn't enough to put my concerns about BPA to rest ... after all, packaged food is jostled-around so much during shipping that these jars could spend days upside down, with the food resting directly on the jar lids.  So I guess I'll have to pass on these jarred Dinners for now.  (The Earth's Best rep did say that they were doing ""accelerated testing"" of BPA-free alternatives for lining their baby food jars).<br /><br />This is such a shame, because Earth's Best is the only company that makes organic, pre-packaged Stage 2 complete meals (e.g., with meat/protein, veggies & carbs/starch) in PUREE form.  All the other organic baby food manufacturers, such as Plum, Sprout, Ella's Kitchen, etc., only make Stage 3 meals, in chunky form.  Earth's Best does make some baby food in BPA-free squeeze pouches, but that doesn't include its Dinner line.  I was hoping to be able to expose my little-one to a wider variety of flavors and well-balanced meals while still at the puree stage.  But I guess I'll have to wait until she's old enough for Stage 3 chunky meals, or make her baby food myself.  (Virtually impossible for this super-busy and domestically-challenged mom, LOL!)"
